{
  "$schema": "https://json-schema.org/draft/2020-12/schema",
  "$id": "https://samsarix.com/schemas/creative-spirals/plan-v1.schema.json",
  "title": "Samsarix Creative Spirals campaign plan",
  "description": "A bounded sequence of local campaign files and optional intended publication times.",
  "type": "object",
  "additionalProperties": false,
  "required": ["schemaVersion", "name", "items"],
  "properties": {
    "schemaVersion": {
      "const": 1,
      "description": "Campaign plan schema version."
    },
    "name": {
      "type": "string",
      "minLength": 1,
      "maxLength": 120,
      "pattern": "^[^\\r\\n]*$"
    },
    "requiredPlatforms": {
      "type": "array",
      "maxItems": 5,
      "uniqueItems": true,
      "items": {
        "enum": ["x", "linkedin", "bluesky", "mastodon", "discord"]
      },
      "default": []
    },
    "items": {
      "type": "array",
      "minItems": 1,
      "maxItems": 100,
      "items": {
        "type": "object",
        "additionalProperties": false,
        "required": ["campaign"],
        "properties": {
          "campaign": {
            "type": "string",
            "minLength": 1,
            "maxLength": 500,
            "pattern": "^(?!/)(?!.*(?:^|/)\\.{1,2}(?:/|$))(?!.*//)(?!.*[<>:\"|?*\\\\])(?!.*[\\u0000-\\u001F\\u007F]).+\\.json$",
            "description": "Portable relative path confined beneath the plan directory."
          },
          "intendedAt": {
            "type": "string",
            "format": "date-time",
            "pattern": "^\\d{4}-\\d{2}-\\d{2}T\\d{2}:\\d{2}:\\d{2}(?:\\.\\d+)?(?:Z|[+-]\\d{2}:\\d{2})$",
            "description": "Optional RFC 3339 time with an explicit UTC offset or Z."
          }
        }
      }
    }
  }
}
